id,pubMedId,publishedDateForPrint,title,authors,openAccess
1109213,18455989,2008 May 02,The endosomal protein Appl1 mediates Akt substrate specificity and cell survival in vertebrate development.,Schenck A; Goto-Silva L; Collinet C; Rhinn M; Giner A; Habermann B; Brand M; Zerial M,False
1115643,18614016,2008 Jul 11,Structural basis for the recognition of c-Src by its inactivator Csk.,Levinson NM; Seeliger MA; Cole PA; Kuriyan J,False
1115729,18585360,2008 Jun 27,Analysis of homeodomain specificities allows the family-wide prediction of preferred recognition sites.,Noyes MB; Christensen RG; Wakabayashi A; Stormo GD; Brodsky MH; Wolfe SA,False
1109498,18510932,2008 May 30,Temporal transcription factors and their targets schedule the end of neural proliferation in Drosophila.,Maurange C; Cheng L; Gould AP,False
1105001,18423204,2008 Apr 18,Rac1 activation controls nuclear localization of beta-catenin during canonical Wnt signaling.,Wu X; Tu X; Joeng KS; Hilton MJ; Williams DA; Long F,False
1103874,18394991,2008 Apr 04,Elevated tRNA(iMet) synthesis can drive cell proliferation and oncogenic transformation.,Marshall L; Kenneth NS; White RJ,False
1115424,18585350,2008 Jun 27,"A polymorphism in CALHM1 influences Ca2+ homeostasis, Abeta levels, and Alzheimer's disease risk.",Dreses-Werringloer U; Lambert JC; Vingtdeux V; Zhao H; Vais H; Siebert A; Jain A; Koppel J; Rovelet-Lecrux A; Hannequin D; Pasquier F; Galimberti D; Scarpini E; Mann D; Lendon C; Campion D; Amouyel P; Davies P; Foskett JK; Campagne F; Marambaud P,False
1115073,18555774,2008 Jun 13,"The amyotrophic lateral sclerosis 8 protein VAPB is cleaved, secreted, and acts as a ligand for Eph receptors.",Tsuda H; Han SM; Yang Y; Tong C; Lin YQ; Mohan K; Haueter C; Zoghbi A; Harati Y; Kwan J; Miller MA; Bellen HJ,False
1100098,18243099,2008 Jan 25,Mps1 phosphorylates Borealin to control Aurora B activity and chromosome alignment.,Jelluma N; Brenkman AB; van den Broek NJ; Cruijsen CW; van Osch MH; Lens SM; Medema RH; Kops GJ,False
1115539,18160038,2007 Dec 28,CENP-B controls centromere formation depending on the chromatin context.,Okada T; Ohzeki J; Nakano M; Yoda K; Brinkley WR; Larionov V; Masumoto H,False
1116474,18394989,2008 Apr 04,RyR1 S-nitrosylation underlies environmental heat stroke and sudden death in Y522S RyR1 knockin mice.,Durham WJ; Aracena-Parks P; Long C; Rossi AE; Goonasekera SA; Boncompagni S; Galvan DL; Gilman CP; Baker MR; Shirokova N; Protasi F; Dirksen R; Hamilton SL,False
1115444,18555783,2008 Jun 13,BAP31 interacts with Sec61 translocons and promotes retrotranslocation of CFTRDeltaF508 via the derlin-1 complex.,Wang B; Heath-Engel H; Zhang D; Nguyen N; Thomas DY; Hanrahan JW; Shore GC,False
1112038,18510924,2008 May 30,XPD helicase structures and activities: insights into the cancer and aging phenotypes from XPD mutations.,Fan L; Fuss JO; Cheng QJ; Arvai AS; Hammel M; Roberts VA; Cooper PK; Tainer JA,False
1115104,18510925,2008 May 30,Structure of the DNA repair helicase XPD.,Liu H; Rudolf J; Johnson KA; McMahon SA; Oke M; Carter L; McRobbie AM; Brown SE; Naismith JH; White MF,False
1116293,18510928,2008 May 30,Capping protein increases the rate of actin-based motility by promoting filament nucleation by the Arp2/3 complex.,Akin O; Mullins RD,False
1109332,18485869,2008 May 16,Rad6-Rad18 mediates a eukaryotic SOS response by ubiquitinating the 9-1-1 checkpoint clamp.,Fu Y; Zhu Y; Zhang K; Yeung M; Durocher D; Xiao W,False
1115327,18510933,2008 May 30,The microRNA miR-1 regulates a MEF-2-dependent retrograde signal at neuromuscular junctions.,Simon DJ; Madison JM; Conery AL; Thompson-Peer KL; Soskis M; Ruvkun GB; Kaplan JM; Kim JK,False
1109455,18485871,2008 May 16,Epigenetic control of rDNA loci in response to intracellular energy status.,Murayama A; Ohmori K; Fujimura A; Minami H; Yasuzawa-Tanaka K; Kuroda T; Oie S; Daitoku H; Okuwaki M; Nagata K; Fukamizu A; Kimura K; Shimizu T; Yanagisawa J,False
1116102,18243104,2008 Jan 25,NFATc1 balances quiescence and proliferation of skin stem cells.,Horsley V; Aliprantis AO; Polak L; Glimcher LH; Fuchs E,False
1108794,18329364,2008 Mar 07,Kid-mediated chromosome compaction ensures proper nuclear envelope formation.,Ohsugi M; Adachi K; Horai R; Kakuta S; Sudo K; Kotaki H; Tokai-Nishizumi N; Sagara H; Iwakura Y; Yamamoto T,False
1108177,18455992,2008 May 02,Application of active and kinase-deficient kinome collection for identification of kinases regulating hedgehog signaling.,Varjosalo M; Björklund M; Cheng F; Syvänen H; Kivioja T; Kilpinen S; Sun Z; Kallioniemi O; Stunnenberg HG; He WW; Ojala P; Taipale J,False
1104214,18329365,2008 Mar 07,The evolution of gene regulation underlies a morphological difference between two Drosophila sister species.,Jeong S; Rebeiz M; Andolfatto P; Werner T; True J; Carroll SB,False
1115076,18358815,2008 Mar 21,Erythrocyte Glut1 triggers dehydroascorbic acid uptake in mammals unable to synthesize vitamin C.,Montel-Hagen A; Kinet S; Manel N; Mongellaz C; Prohaska R; Battini JL; Delaunay J; Sitbon M; Taylor N,False
1109010,18510930,2008 May 30,"Chk1 suppresses a caspase-2 apoptotic response to DNA damage that bypasses p53, Bcl-2, and caspase-3.",Sidi S; Sanda T; Kennedy RD; Hagen AT; Jette CA; Hoffmans R; Pascual J; Imamura S; Kishi S; Amatruda JF; Kanki JP; Green DR; D'Andrea AA; Look AT,False
1113101,18510929,2008 May 30,The big brain aquaporin is required for endosome maturation and notch receptor trafficking.,Kanwar R; Fortini ME,False
1041002,16923388,2006 Aug 25,Matrix elasticity directs stem cell lineage specification.,Engler AJ; Sen S; Sweeney HL; Discher DE,False
1111039,18510927,2008 May 30,Early sexual origins of homeoprotein heterodimerization and evolution of the plant KNOX/BELL family.,Lee JH; Lin H; Joo S; Goodenough U,False
1109019,18191226,2008 Jan 11,A beta-arrestin 2 signaling complex mediates lithium action on behavior.,Beaulieu JM; Marion S; Rodriguiz RM; Medvedev IO; Sotnikova TD; Ghisi V; Wetsel WC; Lefkowitz RJ; Gainetdinov RR; Caron MG,False
1109512,18394996,2008 Apr 04,Rapid synthesis of auxin via a new tryptophan-dependent pathway is required for shade avoidance in plants.,Tao Y; Ferrer JL; Ljung K; Pojer F; Hong F; Long JA; Li L; Moreno JE; Bowman ME; Ivans LJ; Cheng Y; Lim J; Zhao Y; Ballaré CL; Sandberg G; Noel JP; Chory J,False
1109008,18394997,2008 Apr 04,TAA1-mediated auxin biosynthesis is essential for hormone crosstalk and plant development.,Stepanova AN; Robertson-Hoyt J; Yun J; Benavente LM; Xie DY; Dolezal K; Schlereth A; Jürgens G; Alonso JM,False
1108385,18423832,2008 May 02,Highly integrated single-base resolution maps of the epigenome in Arabidopsis.,Lister R; O'Malley RC; Tonti-Filippini J; Gregory BD; Berry CC; Millar AH; Ecker JR,False
1108890,18423199,2008 Apr 18,Meiosis I is established through division-specific translational control of a cyclin.,Carlile TM; Amon A,False
1101143,18267076,2008 Feb 08,Control of chemokine-guided cell migration by ligand sequestration.,Boldajipour B; Mahabaleshwar H; Kardash E; Reichman-Fried M; Blaser H; Minina S; Wilson D; Xu Q; Raz E,False
1109284,18423200,2008 Apr 18,Yeast life span extension by depletion of 60s ribosomal subunits is mediated by Gcn4.,Steffen KK; MacKay VL; Kerr EO; Tsuchiya M; Hu D; Fox LA; Dang N; Johnston ED; Oakes JA; Tchao BN; Pak DN; Fields S; Kennedy BK; Kaeberlein M,False
1108436,18455985,2008 May 02,SRP keeps polypeptides translocation-competent by slowing translation to match limiting ER-targeting sites.,Lakkaraju AK; Mary C; Scherrer A; Johnson AE; Strub K,False
1097536,18160041,2007 Dec 28,STIM2 is a feedback regulator that stabilizes basal cytosolic and endoplasmic reticulum Ca2+ levels.,Brandman O; Liou J; Park WS; Meyer T,False
1097988,17956738,2007 Oct 19,Molecular adaptations underlying susceptibility and resistance to social defeat in brain reward regions.,Krishnan V; Han MH; Graham DL; Berton O; Renthal W; Russo SJ; Laplant Q; Graham A; Lutter M; Lagace DC; Ghose S; Reister R; Tannous P; Green TA; Neve RL; Chakravarty S; Kumar A; Eisch AJ; Self DW; Lee FS; Tamminga CA; Cooper DC; Gershenfeld HK; Nestler EJ,False
1108207,18455988,2008 May 02,"Pirt, a phosphoinositide-binding protein, functions as a regulatory subunit of TRPV1.",Kim AY; Tang Z; Liu Q; Patel KN; Maag D; Geng Y; Dong X,False
1092793,17956733,2007 Oct 19,Self-renewing osteoprogenitors in bone marrow sinusoids can organize a hematopoietic microenvironment.,Sacchetti B; Funari A; Michienzi S; Di Cesare S; Piersanti S; Saggio I; Tagliafico E; Ferrari S; Robey PG; Riminucci M; Bianco P,False
1108530,18394995,2008 Apr 04,Structural mechanism of demethylation and inactivation of protein phosphatase 2A.,Xing Y; Li Z; Chen Y; Stock JB; Jeffrey PD; Shi Y,False
1108462,18455986,2008 May 02,Allosteric regulation of histidine kinases by their cognate response regulator determines cell fate.,Paul R; Jaeger T; Abel S; Wiederkehr I; Folcher M; Biondi EG; Laub MT; Jenal U,False
1109089,18423203,2008 Apr 18,CASK Functions as a Mg2+-independent neurexin kinase.,Mukherjee K; Sharma M; Urlaub H; Bourenkov GP; Jahn R; Südhof TC; Wahl MC,False
1099315,18243103,2008 Jan 25,Rab and Arl GTPase family members cooperate in the localization of the golgin GCC185.,Burguete AS; Fenn TD; Brunger AT; Pfeffer SR,False
1104642,18358811,2008 Mar 21,Cohesin complex promotes transcriptional termination between convergent genes in S. pombe.,Gullerova M; Proudfoot NJ,False
1102123,18237772,2008 Feb 08,Cohesins functionally associate with CTCF on mammalian chromosome arms.,Parelho V; Hadjur S; Spivakov M; Leleu M; Sauer S; Gregson HC; Jarmuz A; Canzonetta C; Webster Z; Nesterova T; Cobb BS; Yokomori K; Dillon N; Aragon L; Fisher AG; Merkenschlager M,False
1103378,18329371,2008 Mar 07,Dicer ablation affects antibody diversity and cell survival in the B lymphocyte lineage.,Koralov SB; Muljo SA; Galler GR; Krek A; Chakraborty T; Kanellopoulou C; Jensen K; Cobb BS; Merkenschlager M; Rajewsky N; Rajewsky K,False
1031081,16469706,2006 Feb 10,Macrophage/cancer cell interactions mediate hormone resistance by a nuclear receptor derepression pathway.,Zhu P; Baek SH; Bourk EM; Ohgi KA; Garcia-Bassets I; Sanjo H; Akira S; Kotol PF; Glass CK; Rosenfeld MG; Rose DW,False
1108134,18342362,2008 Apr 04,Specificity of ARGONAUTE7-miR390 interaction and dual functionality in TAS3 trans-acting siRNA formation.,Montgomery TA; Howell MD; Cuperus JT; Li D; Hansen JE; Alexander AL; Chapman EJ; Fahlgren N; Allen E; Carrington JC,False
1108133,18342361,2008 Apr 04,Sorting of small RNAs into Arabidopsis argonaute complexes is directed by the 5' terminal nucleotide.,Mi S; Cai T; Hu Y; Chen Y; Hodges E; Ni F; Wu L; Li S; Zhou H; Long C; Chen S; Hannon GJ; Qi Y,False
1092803,17956734,2007 Oct 19,Cordon-bleu is an actin nucleation factor and controls neuronal morphology.,Ahuja R; Pinyol R; Reichenbach N; Custer L; Klingensmith J; Kessels MM; Qualmann B,False
1107027,18329373,2008 Mar 07,Dynamic regulation of nucleosome positioning in the human genome.,Schones DE; Cui K; Cuddapah S; Roh TY; Barski A; Wang Z; Wei G; Zhao K,False
1104851,18358814,2008 Mar 21,Direct inhibition of the longevity-promoting factor SKN-1 by insulin-like signaling in C. elegans.,Tullet JM; Hertweck M; An JH; Baker J; Hwang JY; Liu S; Oliveira RP; Baumeister R; Blackwell TK,False
1103995,18394993,2008 Apr 04,Resolution of sister centromeres requires RanBP2-mediated SUMOylation of topoisomerase IIalpha.,Dawlaty MM; Malureanu L; Jeganathan KB; Kao E; Sustmann C; Tahk S; Shuai K; Grosschedl R; van Deursen JM,False
1103671,18358809,2008 Mar 21,FoxA1 translates epigenetic signatures into enhancer-driven lineage-specific transcription.,Lupien M; Eeckhoute J; Meyer CA; Wang Q; Zhang Y; Li W; Carroll JS; Liu XS; Brown M,False
1102186,18267069,2008 Feb 08,Oncogenic BRAF induces senescence and apoptosis through pathways mediated by the secreted protein IGFBP7.,Wajapeyee N; Serra RW; Zhu X; Mahalingam M; Green MR,False
1105084,18423205,2008 Apr 18,Sex-specific control and tuning of the pattern generator for courtship song in Drosophila.,Clyne JD; Miesenböck G,False
1103888,18329370,2008 Mar 07,Regulation of a late phase of T cell polarity and effector functions by Crtam.,Yeh JH; Sidhu SS; Chan AC,False
1103724,18329366,2008 Mar 07,Tyrosine kinases Btk and Tec regulate osteoclast differentiation by linking RANK and ITAM signals.,Shinohara M; Koga T; Okamoto K; Sakaguchi S; Arai K; Yasuda H; Takai T; Kodama T; Morio T; Geha RS; Kitamura D; Kurosaki T; Ellmeier W; Takayanagi H,False
1091080,17889651,2007 Sep 21,Crystal structure of the TLR1-TLR2 heterodimer induced by binding of a tri-acylated lipopeptide.,Jin MS; Kim SE; Heo JY; Lee ME; Kim HM; Paik SG; Lee H; Lee JO,False
1100386,18191227,2008 Jan 11,Docking of axonal mitochondria by syntaphilin controls their mobility and affects short-term facilitation.,Kang JS; Tian JH; Pan PY; Zald P; Li C; Deng C; Sheng ZH,False
1103600,18083101,2007 Dec 14,let-7 regulates self renewal and tumorigenicity of breast cancer cells.,Yu F; Yao H; Zhu P; Zhang X; Pan Q; Gong C; Huang Y; Hu X; Su F; Lieberman J; Song E,False
1103602,18358807,2008 Mar 21,PILRalpha is a herpes simplex virus-1 entry coreceptor that associates with glycoprotein B.,Satoh T; Arii J; Suenaga T; Wang J; Kogure A; Uehori J; Arase N; Shiratori I; Tanaka S; Kawaguchi Y; Spear PG; Lanier LL; Arase H,False
1097688,18083097,2007 Dec 14,Semen-derived amyloid fibrils drastically enhance HIV infection.,Münch J; Rücker E; Ständker L; Adermann K; Goffinet C; Schindler M; Wildum S; Chinnadurai R; Rajan D; Specht A; Giménez-Gallego G; Sánchez PC; Fowler DM; Koulov A; Kelly JW; Mothes W; Grivel JC; Margolis L; Keppler OT; Forssmann WG; Kirchhoff F,False
1103374,18329367,2008 Mar 07,Structural basis of membrane invagination by F-BAR domains.,Frost A; Perera R; Roux A; Spasov K; Destaing O; Egelman EH; De Camilli P; Unger VM,False
1097944,18191222,2008 Jan 11,XMAP215 is a processive microtubule polymerase.,Brouhard GJ; Stear JH; Noetzel TL; Al-Bassam J; Kinoshita K; Harrison SC; Howard J; Hyman AA,False
1102145,18267071,2008 Feb 08,"Identification of the acyltransferase that octanoylates ghrelin, an appetite-stimulating peptide hormone.",Yang J; Brown MS; Liang G; Grishin NV; Goldstein JL,False
1087283,17512406,2007 May 18,Opposing effects of retinoic acid on cell growth result from alternate activation of two different nuclear receptors.,Schug TT; Berry DC; Shaw NS; Travis SN; Noy N,False
1103338,18329363,2008 Mar 07,Phosphorylation of the axial element protein Hop1 by Mec1/Tel1 ensures meiotic interhomolog recombination.,Carballo JA; Johnson AL; Sedgwick SG; Cha RS,False
1092213,17923096,2007 Oct 05,Global analysis of mRNA localization reveals a prominent role in organizing cellular architecture and function.,Lécuyer E; Yoshida H; Parthasarathy N; Alm C; Babak T; Cerovina T; Hughes TR; Tomancak P; Krause HM,False
1099249,18191228,2008 Jan 11,Protons act as a transmitter for muscle contraction in C. elegans.,Beg AA; Ernstrom GG; Nix P; Davis MW; Jorgensen EM,False
1104074,18243096,2008 Jan 25,Beta cells can be generated from endogenous progenitors in injured adult mouse pancreas.,Xu X; D'Hoker J; Stangé G; Bonné S; De Leu N; Xiao X; Van de Casteele M; Mellitzer G; Ling Z; Pipeleers D; Bouwens L; Scharfmann R; Gradwohl G; Heimberg H,False
1092069,17889646,2007 Sep 21,Heat shock factor 1 is a powerful multifaceted modifier of carcinogenesis.,Dai C; Whitesell L; Rogers AB; Lindquist S,False
1091999,17825401,2007 Sep 21,Disrupted-In-Schizophrenia 1 regulates integration of newly generated neurons in the adult brain.,Duan X; Chang JH; Ge S; Faulkner RL; Kim JY; Kitabatake Y; Liu XB; Yang CH; Jordan JD; Ma DK; Liu CY; Ganesan S; Cheng HJ; Ming GL; Lu B; Song H,False
1099133,18191219,2008 Jan 11,Structure of a sliding clamp on DNA.,Georgescu RE; Kim SS; Yurieva O; Kuriyan J; Kong XP; O'Donnell M,False
1098507,18022362,2007 Nov 16,"IAP antagonists induce autoubiquitination of c-IAPs, NF-kappaB activation, and TNFalpha-dependent apoptosis.",Varfolomeev E; Blankenship JW; Wayson SM; Fedorova AV; Kayagaki N; Garg P; Zobel K; Dynek JN; Elliott LO; Wallweber HJ; Flygare JA; Fairbrother WJ; Deshayes K; Dixit VM; Vucic D,False
1102227,18022365,2007 Nov 16,Antisense RNA stabilization induces transcriptional gene silencing via histone deacetylation in S. cerevisiae.,Camblong J; Iglesias N; Fickentscher C; Dieppois G; Stutz F,False
1098821,18155131,2007 Dec 28,RNA-binding protein Dnd1 inhibits microRNA access to target mRNA.,Kedde M; Strasser MJ; Boldajipour B; Oude Vrielink JA; Slanchev K; le Sage C; Nagel R; Voorhoeve PM; van Duijse J; Ørom UA; Lund AH; Perrakis A; Raz E; Agami R,False
1100085,18243100,2008 Jan 25,Rumi is a CAP10 domain glycosyltransferase that modifies Notch and is required for Notch signaling.,Acar M; Jafar-Nejad H; Takeuchi H; Rajan A; Ibrani D; Rana NA; Pan H; Haltiwanger RS; Bellen HJ,False
1100314,17123592,2006 Dec 15,"Multipotent embryonic isl1+ progenitor cells lead to cardiac, smooth muscle, and endothelial cell diversification.",Moretti A; Caron L; Nakano A; Lam JT; Bernshausen A; Chen Y; Qyang Y; Bu L; Sasaki M; Martin-Puig S; Sun Y; Evans SM; Laugwitz KL; Chien KR,False
1099430,18267072,2008 Feb 08,Adenovirus serotype 5 hexon mediates liver gene transfer.,Waddington SN; McVey JH; Bhella D; Parker AL; Barker K; Atoda H; Pink R; Buckley SM; Greig JA; Denby L; Custers J; Morita T; Francischetti IM; Monteiro RQ; Barouch DH; van Rooijen N; Napoli C; Havenga MJ; Nicklin SA; Baker AH,False
1097614,18083105,2007 Dec 14,The classical complement cascade mediates CNS synapse elimination.,Stevens B; Allen NJ; Vazquez LE; Howell GR; Christopherson KS; Nouri N; Micheva KD; Mehalow AK; Huberman AD; Stafford B; Sher A; Litke AM; Lambris JD; Smith SJ; John SW; Barres BA,False
1099330,18191223,2008 Jan 11,Structure of the dual enzyme Ire1 reveals the basis for catalysis and regulation in nonconventional RNA splicing.,Lee KP; Dey M; Neculai D; Cao C; Dever TE; Sicheri F,False
1098888,18160036,2007 Dec 28,Tel2 regulates the stability of PI3K-related protein kinases.,Takai H; Wang RC; Takai KK; Yang H; de Lange T,False
1100142,18160042,2007 Dec 28,Genome-wide high-resolution mapping of exosome substrates reveals hidden features in the Arabidopsis transcriptome.,Chekanova JA; Gregory BD; Reverdatto SV; Chen H; Kumar R; Hooker T; Yazaki J; Li P; Skiba N; Peng Q; Alonso J; Brukhin V; Grossniklaus U; Ecker JR; Belostotsky DA,False
1096022,18035408,2007 Nov 30,Induction of pluripotent stem cells from adult human fibroblasts by defined factors.,Takahashi K; Tanabe K; Ohnuki M; Narita M; Ichisaka T; Tomoda K; Yamanaka S,False
1099234,17981124,2007 Nov 02,SUMO-specific protease 1 is essential for stabilization of HIF1alpha during hypoxia.,Cheng J; Kang X; Zhang S; Yeh ET,False
1099164,17923087,2007 Oct 05,TRIM28 mediates primer binding site-targeted silencing of murine leukemia virus in embryonic cells.,Wolf D; Goff SP,False
1097804,18191224,2008 Jan 11,Dissecting the ER-associated degradation of a misfolded polytopic membrane protein.,Nakatsukasa K; Huyer G; Michaelis S; Brodsky JL,False
1097032,17956736,2007 Oct 19,Glia-like stem cells sustain physiologic neurogenesis in the adult mammalian carotid body.,Pardal R; Ortega-Sáenz P; Durán R; López-Barneo J,False
1097760,18022366,2007 Nov 16,Splicing segregation: the minor spliceosome acts outside the nucleus and controls cell proliferation.,König H; Matter N; Bader R; Thiele W; Müller F,False
1090544,17719548,2007 Aug 24,Growing dendrites and axons differ in their reliance on the secretory pathway.,Ye B; Zhang Y; Song W; Younger SH; Jan LY; Jan YN,False
1097806,17956729,2007 Oct 19,Structure of a Survivin-Borealin-INCENP core complex reveals how chromosomal passengers travel together.,Jeyaprakash AA; Klein UR; Lindner D; Ebert J; Nigg EA; Conti E,False
1085973,17512414,2007 May 18,High-resolution profiling of histone methylations in the human genome.,Barski A; Cuddapah S; Cui K; Roh TY; Schones DE; Wang Z; Wei G; Chepelev I; Zhao K,False
1098875,18160037,2007 Dec 28,Functional architecture of RNA polymerase I.,Kuhn CD; Geiger SR; Baumli S; Gartmann M; Gerber J; Jennebach S; Mielke T; Tschochner H; Beckmann R; Cramer P,False
1097685,18160043,2007 Dec 28,A predictive model for transcriptional control of physiology in a free living cell.,Bonneau R; Facciotti MT; Reiss DJ; Schmid AK; Pan M; Kaur A; Thorsson V; Shannon P; Johnson MH; Bare JC; Longabaugh W; Vuthoori M; Whitehead K; Madar A; Suzuki L; Mori T; Chang DE; Diruggiero J; Johnson CH; Hood L; Baliga NS,False
1097658,18160039,2007 Dec 28,The ATPase SpoIIIE transports DNA across fused septal membranes during sporulation in Bacillus subtilis.,Burton BM; Marquis KA; Sullivan NL; Rapoport TA; Rudner DZ,False
1098904,18022371,2007 Nov 16,Skeletal muscle performance determined by modulation of number of myosin motors rather than motor force or stroke size.,Piazzesi G; Reconditi M; Linari M; Lucii L; Bianco P; Brunello E; Decostre V; Stewart A; Gore DB; Irving TC; Irving M; Lombardi V,False
1097232,17981119,2007 Nov 02,Simian Virus 40 depends on ER protein folding and quality control factors for entry into host cells.,Schelhaas M; Malmström J; Pelkmans L; Haugstetter J; Ellgaard L; Grünewald K; Helenius A,False
1098804,18083098,2007 Dec 14,Subcellular discharge of a serine protease mediates release of invasive malaria parasites from host erythrocytes.,Yeoh S; O'Donnell RA; Koussis K; Dluzewski AR; Ansell KH; Osborne SA; Hackett F; Withers-Martinez C; Mitchell GH; Bannister LH; Bryans JS; Kettleborough CA; Blackman MJ,False
1097635,18083104,2007 Dec 14,Homeostatic levels of p62 control cytoplasmic inclusion body formation in autophagy-deficient mice.,Komatsu M; Waguri S; Koike M; Sou YS; Ueno T; Hara T; Mizushima N; Iwata J; Ezaki J; Murata S; Hamazaki J; Nishito Y; Iemura S; Natsume T; Yanagawa T; Uwayama J; Warabi E; Yoshida H; Ishii T; Kobayashi A; Yamamoto M; Yue Z; Uchiyama Y; Kominami E; Tanaka K,False
1097538,18083103,2007 Dec 14,Growth arrest and autophagy are required for salivary gland cell degradation in Drosophila.,Berry DL; Baehrecke EH,False
1097387,18083102,2007 Dec 14,TAM receptors are pleiotropic inhibitors of the innate immune response.,Rothlin CV; Ghosh S; Zuniga EI; Oldstone MB; Lemke G,False
1098642,18022372,2007 Nov 16,CAPS-1 and CAPS-2 are essential synaptic vesicle priming proteins.,Jockusch WJ; Speidel D; Sigler A; Sørensen JB; Varoqueaux F; Rhee JS; Brose N,False
1097389,17662945,2007 Jul 27,Coupling of rotation and catalysis in F(1)-ATPase revealed by single-molecule imaging and manipulation.,Adachi K; Oiwa K; Nishizaka T; Furuike S; Noji H; Itoh H; Yoshida M; Kinosita K,False
1098655,17981121,2007 Nov 02,Dissecting timing variability in yeast meiosis.,Nachman I; Regev A; Ramanathan S,False
1098271,18045533,2007 Nov 30,Trex1 exonuclease degrades ssDNA to prevent chronic checkpoint activation and autoimmune disease.,Yang YG; Lindahl T; Barnes DE,False
1088747,17599403,2007 Jul 13,ATM prevents the persistence and propagation of chromosome breaks in lymphocytes.,Callén E; Jankovic M; Difilippantonio S; Daniel JA; Chen HT; Celeste A; Pellegrini M; McBride K; Wangsa D; Bredemeyer AL; Sleckman BP; Ried T; Nussenzweig M; Nussenzweig A,False
1098287,17981115,2007 Nov 02,Anti-PlGF inhibits growth of VEGF(R)-inhibitor-resistant tumors without affecting healthy vessels.,Fischer C; Jonckx B; Mazzone M; Zacchigna S; Loges S; Pattarini L; Chorianopoulos E; Liesenborghs L; Koch M; De Mol M; Autiero M; Wyns S; Plaisance S; Moons L; van Rooijen N; Giacca M; Stassen JM; Dewerchin M; Collen D; Carmeliet P,False
1093755,17956728,2007 Oct 19,Regulation of tumor cell mitochondrial homeostasis by an organelle-specific Hsp90 chaperone network.,Kang BH; Plescia J; Dohi T; Rosa J; Doxsey SJ; Altieri DC,False
1097185,18022363,2007 Nov 16,IAP antagonists target cIAP1 to induce TNFalpha-dependent apoptosis.,Vince JE; Wong WW; Khan N; Feltham R; Chau D; Ahmed AU; Benetatos CA; Chunduru SK; Condon SM; McKinlay M; Brink R; Leverkus M; Tergaonkar V; Schneider P; Callus BA; Koentgen F; Vaux DL; Silke J,False
1098108,18001824,2007 Nov 30,RNF8 ubiquitylates histones at DNA double-strand breaks and promotes assembly of repair proteins.,Mailand N; Bekker-Jensen S; Faustrup H; Melander F; Bartek J; Lukas C; Lukas J,False
1098145,18001825,2007 Nov 30,RNF8 transduces the DNA-damage signal via histone ubiquitylation and checkpoint protein assembly.,Huen MS; Grant R; Manke I; Minn K; Yu X; Yaffe MB; Chen J,False
1098415,18022370,2007 Nov 16,LIMP-2 is a receptor for lysosomal mannose-6-phosphate-independent targeting of beta-glucocerebrosidase.,Reczek D; Schwake M; Schröder J; Hughes H; Blanz J; Jin X; Brondyk W; Van Patten S; Edmunds T; Saftig P,False
1090757,17803910,2007 Sep 07,Structure and mechanism of a metal-sensing regulatory RNA.,Dann CE; Wakeman CA; Sieling CL; Baker SC; Irnov I; Winkler WC,False
1094980,17981118,2007 Nov 02,Hydrodynamic flow-mediated protein sorting on the cell surface of trypanosomes.,Engstler M; Pfohl T; Herminghaus S; Boshart M; Wiegertjes G; Heddergott N; Overath P,False
1094897,17981122,2007 Nov 02,Functional specificity among ribosomal proteins regulates gene expression.,Komili S; Farny NG; Roth FP; Silver PA,False
1098196,18045534,2007 Nov 30,Impaired tRNA nuclear export links DNA damage and cell-cycle checkpoint.,Ghavidel A; Kislinger T; Pogoutse O; Sopko R; Jurisica I; Emili A,False
1098323,17956737,2007 Oct 19,Differentiated horizontal interneurons clonally expand to form metastatic retinoblastoma in mice.,Ajioka I; Martins RA; Bayazitov IT; Donovan S; Johnson DA; Frase S; Cicero SA; Boyd K; Zakharenko SS; Dyer MA,False
1092775,17693259,2007 Aug 10,A saturated FG-repeat hydrogel can reproduce the permeability properties of nuclear pore complexes.,Frey S; Görlich D,False
