id,pubMedId,publishedDateForPrint,title,authors,openAccess
730526705,28867286,2017 Sep 21,Load adaptation of lamellipodial actin networks.,Mueller J; Szep G; Nemethova M; de Vries I; Lieber AD; Winkler C; Kruse K; Small JV; Schmeiser C; Keren K; Hauschild R; Sixt M,False
732571453,29373830,2018 01 25,Targeting KRAS Mutant Cancers with a Covalent G12C-Specific Inhibitor.,Janes MR; Zhang J; Li LS; Hansen R; Peters U; Guo X; Chen Y; Babbar A; Firdaus SJ; Darjania L; Feng J; Chen JH; Li S; Li S; Long YO; Thach C; Liu Y; Zarieh A; Ely T; Kucharski JM; Kessler LV; Wu T; Yu K; Wang Y; Yao Y; Deng X; Zarrinkar PP; Brehmer D; Dhanak D; Lorenzi MV; Hu-Lowe D; Patricelli MP; Ren P; Liu Y,False
727622463,28525759,2017 May 18,Modeling Rett Syndrome Using TALEN-Edited MECP2 Mutant Cynomolgus Monkeys.,Chen Y; Yu J; Niu Y; Qin D; Liu H; Li G; Hu Y; Wang J; Lu Y; Kang Y; Jiang Y; Wu K; Li S; Wei J; He J; Wang J; Liu X; Luo Y; Si C; Bai R; Zhang K; Liu J; Huang S; Chen Z; Wang S; Chen X; Bao X; Zhang Q; Li F; Geng R; Liang A; Shen D; Jiang T; Hu X; Ma Y; Ji W; Sun YE,False
732025725,29056337,2017 Nov 16,Early-Life Gene Expression in Neurons Modulates Lasting Epigenetic States.,Stroud H; Su SC; Hrvatin S; Greben AW; Renthal W; Boxer LD; Nagy MA; Hochbaum DR; Kinde B; Gabel HW; Greenberg ME,False
732738738,29474919,2018 02 22,"Pervasive, Coordinated Protein-Level Changes Driven by Transcript Isoform Switching during Meiosis.",Cheng Z; Otto GM; Powers EN; Keskin A; Mertins P; Carr SA; Jovanovic M; Brar GA,False
727236841,28086098,2017 Jan 12,30 Years of NF-κB: A Blossoming of Relevance to Human Pathobiology.,Zhang Q; Lenardo MJ; Baltimore D,False
732810968,29526462,2018 03 22,Translocon Declogger Ste24 Protects against IAPP Oligomer-Induced Proteotoxicity.,Kayatekin C; Amasino A; Gaglia G; Flannick J; Bonner JM; Fanning S; Narayan P; Barrasa MI; Pincus D; Landgraf D; Nelson J; Hesse WR; Costanzo M; AMP T2D-GENES Consortium; Myers CL; Boone C; Florez JC; Lindquist S,False
732443296,29328918,2018 01 11,Transmembrane Pickets Connect Cyto- and Pericellular Skeletons Forming Barriers to Receptor Engagement.,Freeman SA; Vega A; Riedl M; Collins RF; Ostrowski PP; Woods EC; Bertozzi CR; Tammi MI; Lidke DS; Johnson P; Mayor S; Jaqaman K; Grinstein S,False
726489612,27397505,2016 Jul 28,A landscape of pharmacogenomic interactions in cancer.,Iorio F; Knijnenburg TA; Vis DJ; Bignell GR; Menden MP; Schubert M; Aben N; Gonçalves E; Barthorpe S; Lightfoot H; Cokelaer T; Greninger P; van Dyk E; Chang H; de Silva H; Heyn H; Deng X; Egan RK; Liu Q; Mironenko T; Mitropoulos X; Richardson L; Wang J; Zhang T; Moran S; Sayols S; Soleimani M; Tamborero D; Lopez-Bigas N; Ross-Macdonald P; Esteller M; Gray NS; Haber DA; Stratton MR; Benes CH; Wessels LFA; Saez-Rodriguez J; McDermott U; Garnett MJ,False
731997462,29033131,2017 Nov 16,Oxysterol restraint of cholesterol synthesis prevents AIM2 inflammasome activation.,Dang EV; McDonald JG; Russell DW; Cyster JG,False
732542355,29361316,2018 01 25,Structure and conformational dynamics of the human spliceosomal bact complex.,Haselbach D; Komarov I; Agafonov DE; Hartmuth K; Graf B; Dybkov O; Urlaub H; Kastner B; Lührmann R; Stark H,False
727471413,28366204,2017 Apr 06,RIPK3 Restricts Viral Pathogenesis via Cell Death-Independent Neuroinflammation.,Daniels BP; Snyder AG; Olsen TM; Orozco S; Oguin TH; Tait SWG; Martinez J; Gale M; Loo YM; Oberst A,False
725354521,25679759,2015 Feb 12,A serpin shapes the extracellular environment to prevent influenza A virus maturation.,Dittmann M; Hoffmann HH; Scull MA; Gilmore RH; Bell KL; Ciancanelli M; Wilson SJ; Crotta S; Yu Y; Flatley B; Xiao JW; Casanova JL; Wack A; Bieniasz PD; Rice CM,False
732291286,29245013,2017 Dec 14,Combination Cancer Therapy Can Confer Benefit via Patient-to-Patient Variability without Drug Additivity or Synergy.,Palmer AC; Sorger PK,False
727280568,28162770,2017 02 23,Gene Essentiality Profiling Reveals Gene Networks and Synthetic Lethal Interactions with Oncogenic Ras.,Wang T; Yu H; Hughes NW; Liu B; Kendirli A; Klein K; Chen WW; Lander ES; Sabatini DM,False
732499377,29336889,2018 02 08,KRAS dimerization impacts MEK inhibitor sensitivity and oncogenic activity of mutant KRAS.,Ambrogio C; Köhler J; Zhou ZW; Wang H; Paranal R; Li J; Capelletti M; Caffarra C; Li S; Lv Q; Gondi S; Hunter JC; Lu J; Chiarle R; Santamaría D; Westover KD; Jänne PA,False
732441823,29328915,2018 01 11,Retrovirus-like Gag Protein Arc1 Binds RNA and Traffics across Synaptic Boutons.,Ashley J; Cordy B; Lucia D; Fradkin LG; Budnik V; Thomson T,False
1007482,12086671,2002 Jun 14,Transcriptional mechanisms underlying lymphocyte tolerance.,Macián F; García-Cózar F; Im SH; Horton HF; Byrne MC; Rao A,False
725245303,25417155,2014 Nov 06,Deterministic progenitor behavior and unitary production of neurons in the neocortex.,Gao P; Postiglione MP; Krieger TG; Hernandez L; Wang C; Han Z; Streicher C; Papusheva E; Insolera R; Chugh K; Kodish O; Huang K; Simons BD; Luo L; Hippenmeyer S; Shi SH,False
725508338,26000488,2015 May 21,Highly Parallel Genome-wide Expression Profiling of Individual Cells Using Nanoliter Droplets.,Macosko EZ; Basu A; Satija R; Nemesh J; Shekhar K; Goldman M; Tirosh I; Bialas AR; Kamitaki N; Martersteck EM; Trombetta JJ; Weitz DA; Sanes JR; Shalek AK; Regev A; McCarroll SA,False
725508825,26000487,2015 May 21,Droplet barcoding for single-cell transcriptomics applied to embryonic stem cells.,Klein AM; Mazutis L; Akartuna I; Tallapragada N; Veres A; Li V; Peshkin L; Weitz DA; Kirschner MW,False
725809247,26406371,2015 Sep 24,Molecular identity of human outer radial glia during cortical development.,Pollen AA; Nowakowski TJ; Chen J; Retallack H; Sandoval-Espinosa C; Nicholas CR; Shuga J; Liu SJ; Oldham MC; Diaz A; Lim DA; Leyrat AA; West JA; Kriegstein AR,False
725571278,26091041,2015 Jun 18,Embryonic origin of postnatal neural stem cells.,Fuentealba LC; Rompani SB; Parraguez JI; Obernier K; Romero R; Cepko CL; Alvarez-Buylla A,False
732589846,29395327,2018 02 08,Cloning of macaque monkeys by somatic cell nuclear transfer.,Liu Z; Cai Y; Wang Y; Nie Y; Zhang C; Xu Y; Zhang X; Lu Y; Wang Z; Poo M; Sun Q,False
732304611,29245011,2017 Dec 14,"Oncogenic Role of THOR, a Conserved Cancer/Testis Long Non-coding RNA.",Hosono Y; Niknafs YS; Prensner JR; Iyer MK; Dhanasekaran SM; Mehra R; Pitchiaya S; Tien J; Escara-Wilke J; Poliakov A; Chu SC; Saleh S; Sankar K; Su F; Guo S; Qiao Y; Freier SM; Bui HH; Cao X; Malik R; Johnson TM; Beer DG; Feng FY; Zhou W; Chinnaiyan AM,False
732535470,29358049,2018 01 25,Ultraconserved enhancers are required for normal development.,Dickel DE; Ypsilanti AR; Pla R; Zhu Y; Barozzi I; Mannion BJ; Khin YS; Fukuda-Yuzawa Y; Plajzer-Frick I; Pickle CS; Lee EA; Harrington AN; Pham QT; Garvin TH; Kato M; Osterwalder M; Akiyama JA; Afzal V; Rubenstein JLR; Pennacchio LA; Visel A,False
731219358,28919077,2017 Oct 05,Engineering quantitative trait variation for crop improvement by genome editing.,Rodríguez-Leal D; Lemmon ZH; Man J; Bartlett ME; Lippman ZB,False
732121293,29149603,2017 Nov 16,Structural basis of mitochondrial transcription initiation.,Hillen HS; Morozov YI; Sarfallah A; Temiakov D; Cramer P,False
725963374,26607793,2015 Dec 03,CD5L/AIM regulates lipid biosynthesis and restrains th17 cell pathogenicity.,Wang C; Yosef N; Gaublomme J; Wu C; Lee Y; Clish CB; Kaminski J; Xiao S; Meyer Zu Horste G; Pawlak M; Kishi Y; Joller N; Karwacz K; Zhu C; Ordovas-Montanes M; Madi A; Wortman I; Miyazaki T; Sobel RA; Park H; Regev A; Kuchroo VK,False
727374882,28262351,2017 03 09,An Intestinal Organ Culture System Uncovers a Role for the Nervous System in Microbe-Immune Crosstalk.,Yissachar N; Zhou Y; Ung L; Lai NY; Mohan JF; Ehrlicher A; Weitz DA; Kasper DL; Chiu IM; Mathis D; Benoist C,False
725813803,26411289,2015 Oct 08,Th17 cell induction by adhesion of microbes to intestinal epithelial cells.,Atarashi K; Tanoue T; Ando M; Kamada N; Nagano Y; Narushima S; Suda W; Imaoka A; Setoyama H; Nagamori T; Ishikawa E; Shima T; Hara T; Kado S; Jinnohara T; Ohno H; Kondo T; Toyooka K; Watanabe E; Yokoyama S; Tokoro S; Mori H; Noguchi Y; Morita H; Ivanov II; Sugiyama T; Nuñez G; Camp JG; Hattori M; Umesaki Y; Honda K,False
732386765,29290465,2018 01 25,Selenium Utilization by GPX4 Is Required to Prevent Hydroperoxide-Induced Ferroptosis.,Ingold I; Berndt C; Schmitt S; Doll S; Poschmann G; Buday K; Roveri A; Peng X; Porto Freitas F; Seibt T; Mehr L; Aichler M; Walch A; Lamp D; Jastroch M; Miyamoto S; Wurst W; Ursini F; Arnér ESJ; Fradejas-Villar N; Schweizer U; Zischka H; Friedmann Angeli JP; Conrad M,False
727807129,28708997,2017 Jul 13,Vaccine Mediated Protection Against Zika Virus-Induced Congenital Disease.,Richner JM; Jagger BW; Shan C; Fontes CR; Dowd KA; Cao B; Himansu S; Caine EA; Nunes BTD; Medeiros DBA; Muruato AE; Foreman BM; Luo H; Wang T; Barrett AD; Weaver SC; Vasconcelos PFC; Rossi SL; Ciaramella G; Mysorekar IU; Pierson TC; Shi PY; Diamond MS,False
727443013,28340344,2017 03 23,Modified mRNA Vaccines Protect against Zika Virus Infection.,Richner JM; Himansu S; Dowd KA; Butler SL; Salazar V; Fox JM; Julander JG; Tang WW; Shresta S; Pierson TC; Ciaramella G; Diamond MS,False
727586498,28475892,2017 May 04,Recurrent potent human neutralizing antibodies to zika virus in brazil and mexico.,Robbiani DF; Bozzacco L; Keeffe JR; Khouri R; Olsen PC; Gazumyan A; Schaefer-Babajew D; Avila-Rios S; Nogueira L; Patel R; Azzopardi SA; Uhl LFK; Saeed M; Sevilla-Reyes EE; Agudelo M; Yao KH; Golijanin J; Gristick HB; Lee YE; Hurley A; Caskey M; Pai J; Oliveira T; Wunder EA; Sacramento G; Nery N; Orge C; Costa F; Reis MG; Thomas NM; Eisenreich T; Weinberger DM; de Almeida ARP; West AP; Rice CM; Bjorkman PJ; Reyes-Teran G; Ko AI; MacDonald MR; Nussenzweig MC,False
727022281,27884405,2016 Dec 01,Zika virus causes testis damage and leads to male infertility in mice.,Ma W; Li S; Ma S; Jia L; Zhang F; Zhang Y; Zhang J; Wong G; Zhang S; Lu X; Liu M; Yan J; Li W; Qin C; Han D; Qin C; Wang N; Li X; Gao GF,False
732415251,29307490,2018 01 11,Drug-Driven Phenotypic Convergence Supports Rational Treatment Strategies of Chronic Infections.,Imamovic L; Ellabaan MMH; Dantas Machado AM; Citterio L; Wulff T; Molin S; Krogh Johansen H; Sommer MOA,False
726076897,26771487,2016 Jan 14,Force Feedback Controls Motor Activity and Mechanical Properties of Self-Assembling Branched Actin Networks.,Bieling P; Li TD; Weichsel J; McGorty R; Jreij P; Huang B; Fletcher DA; Mullins RD,False
732444485,29328914,2018 01 11,Rewiring of the fruit metabolome in tomato breeding.,Zhu G; Wang S; Huang Z; Zhang S; Liao Q; Zhang C; Lin T; Qin M; Peng M; Yang C; Cao X; Han X; Wang X; van der Knaap E; Zhang Z; Cui X; Klee H; Fernie AR; Luo J; Huang S,False
732304610,29245012,2017 Dec 14,Visualizing the Assembly Pathway of Nucleolar Pre-60S Ribosomes.,Kater L; Thoms M; Barrio-Garcia C; Cheng J; Ismail S; Ahmed YL; Bange G; Kressler D; Berninghausen O; Sinning I; Hurt E; Beckmann R,False
732206283,29195076,2017 Nov 30,Migrating Platelets Are Mechano-scavengers that Collect and Bundle Bacteria.,Gaertner F; Ahmad Z; Rosenberger G; Fan S; Nicolai L; Busch B; Yavuz G; Luckner M; Ishikawa-Ankerhold H; Hennel R; Benechet A; Lorenz M; Chandraratne S; Schubert I; Helmer S; Striednig B; Stark K; Janko M; Böttcher RT; Verschoor A; Leon C; Gachet C; Gudermann T; Mederos Y Schnitzler M; Pincus Z; Iannacone M; Haas R; Wanner G; Lauber K; Sixt M; Massberg S,False
732378223,29290469,2018 01 11,Allosteric coupling of drug binding and intracellular signaling in the A2A adenosine receptor.,Eddy MT; Lee MY; Gao ZG; White KL; Didenko T; Horst R; Audet M; Stanczak P; McClary KM; Han GW; Jacobson KA; Stevens RC; Wüthrich K,False
732364663,29275861,2018 01 25,Natural killer cells control tumor growth by sensing a growth factor.,Barrow AD; Edeling MA; Trifonov V; Luo J; Goyal P; Bohl B; Bando JK; Kim AH; Walker J; Andahazy M; Bugatti M; Melocchi L; Vermi W; Fremont DH; Cox S; Cella M; Schmedt C; Colonna M,False
732296492,29245010,2017 Dec 14,Our gut microbiome: the evolving inner self.,Kundu P; Blacher E; Elinav E; Pettersson S,False
727682600,28575672,2017 Jun 01,A class of environmental and endogenous toxins induces BRCA2 haploinsufficiency and genome instability.,Tan SLW; Chadha S; Liu Y; Gabasova E; Perera D; Ahmed K; Constantinou S; Renaudin X; Lee M; Aebersold R; Venkitaraman AR,False
727721904,28622506,2017 Jun 15,Dynamic RNA modifications in gene expression regulation.,Roundtree IA; Evans ME; Pan T; He C,False
732335587,29275859,2018 01 25,Microbiome Influences Prenatal and Adult Microglia in a Sex-Specific Manner.,Thion MS; Low D; Silvin A; Chen J; Grisel P; Schulte-Schrepping J; Blecher R; Ulas T; Squarzoni P; Hoeffel G; Coulpier F; Siopi E; David FS; Scholz C; Shihui F; Lum J; Amoyo AA; Larbi A; Poidinger M; Buttgereit A; Lledo PM; Greter M; Chan JKY; Amit I; Beyer M; Schultze JL; Schlitzer A; Pettersson S; Ginhoux F; Garel S,False
727586500,28475890,2017 05 04,Metabolic instruction of immunity.,Buck MD; Sowell RT; Kaech SM; Pearce EL,False
718696320,8334704,1993 Jul 16,Mammalian Ras interacts directly with the serine/threonine kinase Raf.,Vojtek AB; Hollenberg SM; Cooper JA,False
725332612,25635456,2015 Jan 29,HIV-1 integration landscape during latent and active infection.,Cohn LB; Silva IT; Oliveira TY; Rosales RA; Parrish EH; Learn GH; Hahn BH; Czartoski JL; McElrath MJ; Lehmann C; Klein F; Caskey M; Walker BD; Siliciano JD; Siliciano RF; Jankovic M; Nussenzweig MC,False
732394953,29307491,2018 01 11,Structure of the Nanobody-Stabilized Active State of the Kappa Opioid Receptor.,Che T; Majumdar S; Zaidi SA; Ondachi P; McCorvy JD; Wang S; Mosier PD; Uprety R; Vardy E; Krumm BE; Han GW; Lee MY; Pardon E; Steyaert J; Huang XP; Strachan RT; Tribo AR; Pasternak GW; Carroll FI; Stevens RC; Cherezov V; Katritch V; Wacker D; Roth BL,False
727310469,28215707,2017 Feb 23,HSP90 shapes the consequences of human genetic variation.,Karras GI; Yi S; Sahni N; Fischer M; Xie J; Vidal M; D'Andrea AD; Whitesell L; Lindquist S,False
732289961,29249361,2018 01 11,Pharmacogenomics of GPCR drug targets.,Hauser AS; Chavali S; Masuho I; Jahn LJ; Martemyanov KA; Gloriam DE; Babu MM,False
726869565,27768889,2016 Oct 20,Genetic ancestry and natural selection drive population differences in immune responses to pathogens.,Nédélec Y; Sanz J; Baharian G; Szpiech ZA; Pacis A; Dumaine A; Grenier JC; Freiman A; Sams AJ; Hebert S; Pagé Sabourin A; Luca F; Blekhman R; Hernandez RD; Pique-Regi R; Tung J; Yotova V; Barreiro LB,False
732233889,29224783,2017 Dec 14,In Vivo Target Gene Activation via CRISPR/Cas9-Mediated Trans-epigenetic Modulation.,Liao HK; Hatanaka F; Araoka T; Reddy P; Wu MZ; Sui Y; Yamauchi T; Sakurai M; O'Keefe DD; Núñez-Delicado E; Guillen P; Campistol JM; Wu CJ; Lu LF; Esteban CR; Izpisua Belmonte JC,False
726141020,26871631,2016 Feb 11,Self-Organization of Embryonic Genetic Oscillators into Spatiotemporal Wave Patterns.,Tsiairis CD; Aulehla A,False
727844795,28757253,2017 Aug 24,Enhancer reprogramming promotes pancreatic cancer metastasis.,Roe JS; Hwang CI; Somerville TDD; Milazzo JP; Lee EJ; Da Silva B; Maiorino L; Tiriac H; Young CM; Miyabayashi K; Filippini D; Creighton B; Burkhart RA; Buscaglia JM; Kim EJ; Grem JL; Lazenby AJ; Grunkemeyer JA; Hollingsworth MA; Grandgenett PM; Egeblad M; Park Y; Tuveson DA; Vakoc CR,False
728378478,28802044,2017 Aug 10,The neuropeptide corazonin controls social behavior and caste identity in ants.,Gospocic J; Shields EJ; Glastad KM; Lin Y; Penick CA; Yan H; Mikheyev AS; Linksvayer TA; Garcia BA; Berger SL; Liebig J; Reinberg D; Bonasio R,False
727787119,28689640,2017 Jul 13,Distinct ventral pallidal neural populations mediate separate symptoms of depression.,Knowland D; Lilascharoen V; Pacia CP; Shin S; Wang EH; Lim BK,False
726619881,27499023,2016 Aug 11,Memory of inflammation in regulatory T cells.,van der Veeken J; Gonzalez AJ; Cho H; Arvey A; Hemmers S; Leslie CS; Rudensky AY,False
726881087,27773482,2016 11 03,Regulatory T Cell Specificity Directs Tolerance versus Allergy against Aeroantigens in Humans.,Bacher P; Heinrich F; Stervbo U; Nienen M; Vahldieck M; Iwert C; Vogt K; Kollet J; Babel N; Sawitzki B; Schwarz C; Bereswill S; Heimesaat MM; Heine G; Gadermaier G; Asam C; Assenmacher M; Kniemeyer O; Brakhage AA; Ferreira F; Wallner M; Worm M; Scheffold A,False
725745419,26317471,2015 Aug 27,A distinct function of regulatory T cells in tissue protection.,Arpaia N; Green JA; Moltedo B; Arvey A; Hemmers S; Yuan S; Treuting PM; Rudensky AY,False
732136481,29153834,2017 Nov 30,Precise editing at DNA replication forks enables multiplex genome engineering in eukaryotes.,Barbieri EM; Muir P; Akhuetie-Oni BO; Yellman CM; Isaacs FJ,False
732121578,29149607,2017 Nov 16,Classifying Drosophila Olfactory Projection Neuron Subtypes by Single-Cell RNA Sequencing.,Li H; Horns F; Wu B; Xie Q; Li J; Li T; Luginbuhl DJ; Quake SR; Luo L,False
731997464,29033128,2017 Nov 16,The DNA Inflammasome in Human Myeloid Cells Is Initiated by a STING-Cell Death Program Upstream of NLRP3.,Gaidt MM; Ebert TS; Chauhan D; Ramshorn K; Pinci F; Zuber S; O'Duill F; Schmid-Burgk JL; Hoss F; Buhmann R; Wittmann G; Latz E; Subklewe M; Hornung V,False
732079829,29103613,2017 Nov 30,Ancestral circuits for the coordinated modulation of brain state.,Lovett-Barron M; Andalman AS; Allen WE; Vesuna S; Kauvar I; Burns VM; Deisseroth K,False
731077757,28890085,2017 Sep 21,In situ architecture and cellular interactions of polyq inclusions.,Bäuerlein FJB; Saha I; Mishra A; Kalemanov M; Martínez-Sánchez A; Klein R; Dudanova I; Hipp MS; Hartl FU; Baumeister W; Fernández-Busnadiego R,False
732135370,29153836,2017 Dec 14,Post-transcriptional Regulation of De Novo Lipogenesis by mTORC1-S6K1-SRPK2 Signaling.,Lee G; Zheng Y; Cho S; Jang C; England C; Dempsey JM; Yu Y; Liu X; He L; Cavaliere PM; Chavez A; Zhang E; Isik M; Couvillon A; Dephoure NE; Blackwell TK; Yu JJ; Rabinowitz JD; Cantley LC; Blenis J,False
727840927,28753427,2017 Jul 27,A Genetic Variant Associated with Five Vascular Diseases Is a Distal Regulator of Endothelin-1 Gene Expression.,Gupta RM; Hadaya J; Trehan A; Zekavat SM; Roselli C; Klarin D; Emdin CA; Hilvering CRE; Bianchi V; Mueller C; Khera AV; Ryan RJH; Engreitz JM; Issner R; Shoresh N; Epstein CB; de Laat W; Brown JD; Schnabel RB; Bernstein BE; Kathiresan S,False
730375382,28867285,2017 Sep 07,Mating in the closest living relatives of animals is induced by a bacterial chondroitinase.,Woznica A; Gerdt JP; Hulett RE; Clardy J; King N,False
726306223,27104980,2016 Apr 21,A Small Molecule RAS-Mimetic Disrupts RAS Association with Effector Proteins to Block Signaling.,Athuluri-Divakar SK; Vasquez-Del Carpio R; Dutta K; Baker SJ; Cosenza SC; Basu I; Gupta YK; Reddy MV; Ueno L; Hart JR; Vogt PK; Mulholland D; Guha C; Aggarwal AK; Reddy EP,False
731997463,29033129,2017 Oct 19,Genome-Nuclear Lamina Interactions Regulate Cardiac Stem Cell Lineage Restriction.,Poleshko A; Shah PP; Gupta M; Babu A; Morley MP; Manderfield LJ; Ifkovits JL; Calderon D; Aghajanian H; Sierra-Pagán JE; Sun Z; Wang Q; Li L; Dubois NC; Morrisey EE; Lazar MA; Smith CL; Epstein JA; Jain R,False
728639308,28803727,2017 Aug 24,Elimination of Toxic Microsatellite Repeat Expansion RNA by RNA-Targeting Cas9.,Batra R; Nelles DA; Pirie E; Blue SM; Marina RJ; Wang H; Chaim IA; Thomas JD; Zhang N; Nguyen V; Aigner S; Markmiller S; Xia G; Corbett KD; Swanson MS; Yeo GW,False
727682034,28575669,2017 Jun 01,The Mammalian Ribo-interactome Reveals Ribosome Functional Diversity and Heterogeneity.,Simsek D; Tiu GC; Flynn RA; Byeon GW; Leppek K; Xu AF; Chang HY; Barna M,False
731602778,28965759,2017 Nov 02,Temporal control of mammalian cortical neurogenesis by m6a methylation.,Yoon KJ; Ringeling FR; Vissers C; Jacob F; Pokrass M; Jimenez-Cyrus D; Su Y; Kim NS; Zhu Y; Zheng L; Kim S; Wang X; Doré LC; Jin P; Regot S; Zhuang X; Canzar S; He C; Ming GL; Song H,False
726235867,27015305,2016 Mar 24,Ribosome Footprint Profiling of Translation throughout the Genome.,Ingolia NT,False
727677950,28575665,2017 Jun 01,Senescence in health and disease.,He S; Sharpless NE,False
727620604,28525757,2017 May 18,Widespread Influence of 3'-End Structures on Mammalian mRNA Processing and Stability.,Wu X; Bartel DP,False
726337418,27153495,2016 May 05,Maternal igg and iga antibodies dampen mucosal T helper cell responses in early life.,Koch MA; Reiner GL; Lugo KA; Kreuk LS; Stanbery AG; Ansaldo E; Seher TD; Ludington WB; Barton GM,False
726861765,27768887,2016 Oct 20,Progressive Loss of Function in a Limb Enhancer during Snake Evolution.,Kvon EZ; Kamneva OK; Melo US; Barozzi I; Osterwalder M; Mannion BJ; Tissières V; Pickle CS; Plajzer-Frick I; Lee EA; Kato M; Garvin TH; Akiyama JA; Afzal V; Lopez-Rios J; Rubin EM; Dickel DE; Pennacchio LA; Visel A,False
728378476,28802047,2017 Aug 10,Dual ifgMosaic: A Versatile Method for Multispectral and Combinatorial Mosaic Gene-Function Analysis.,Pontes-Quero S; Heredia L; Casquero-García V; Fernández-Chacón M; Luo W; Hermoso A; Bansal M; Garcia-Gonzalez I; Sanchez-Muñoz MS; Perea JR; Galiana-Simal A; Rodriguez-Arabaolaza I; Del Olmo-Cabrera S; Rocha SF; Criado-Rodriguez LM; Giovinazzo G; Benedito R,False
732079700,29107329,2017 Nov 02,Cytosolic protein vms1 links ribosome quality control to mitochondrial and cellular homeostasis.,Izawa T; Park SH; Zhao L; Hartl FU; Neupert W,False
725274914,25417106,2014 Oct 23,Enhancer interaction networks as a means for singular olfactory receptor expression.,Markenscoff-Papadimitriou E; Allen WE; Colquitt BM; Goh T; Murphy KK; Monahan K; Mosley CP; Ahituv N; Lomvardas S,False
726984284,27863251,2016 11 17,Genetic drivers of epigenetic and transcriptional variation in human immune cells.,Chen L; Ge B; Casale FP; Vasquez L; Kwan T; Garrido-Martín D; Watt S; Yan Y; Kundu K; Ecker S; Datta A; Richardson D; Burden F; Mead D; Mann AL; Fernandez JM; Rowlston S; Wilder SP; Farrow S; Shao X; Lambourne JJ; Redensek A; Albers CA; Amstislavskiy V; Ashford S; Berentsen K; Bomba L; Bourque G; Bujold D; Busche S; Caron M; Chen SH; Cheung W; Delaneau O; Dermitzakis ET; Elding H; Colgiu I; Bagger FO; Flicek P; Habibi E; Iotchkova V; Janssen-Megens E; Kim B; Lehrach H; Lowy E; Mandoli A; Matarese F; Maurano MT; Morris JA; Pancaldi V; Pourfarzad F; Rehnstrom K; Rendon A; Risch T; Sharifi N; Simon MM; Sultan M; Valencia A; Walter K; Wang SY; Frontini M; Antonarakis SE; Clarke L; Yaspo ML; Beck S; Guigo R; Rico D; Martens JHA; Ouwehand WH; Kuijpers TW; Paul DS; Stunnenberg HG; Stegle O; Downes K; Pastinen T; Soranzo N,False
725809241,26406378,2015 Sep 24,Tracing dynamic changes of DNA methylation at single-cell resolution.,Stelzer Y; Shivalila CS; Soldner F; Markoulaki S; Jaenisch R,False
727795788,28689641,2017 Jul 13,Life-Long Genetic and Functional Access to Neural Circuits Using Self-Inactivating Rabies Virus.,Ciabatti E; González-Rueda A; Mariotti L; Morgese F; Tripodi M,False
726141019,26871632,2016 Feb 11,Myc depletion induces a pluripotent dormant state mimicking diapause.,Scognamiglio R; Cabezas-Wallscheid N; Thier MC; Altamura S; Reyes A; Prendergast ÁM; Baumgärtner D; Carnevalli LS; Atzberger A; Haas S; von Paleske L; Boroviak T; Wörsdörfer P; Essers MA; Kloz U; Eisenman RN; Edenhofer F; Bertone P; Huber W; van der Hoeven F; Smith A; Trumpp A,False
732025723,29056340,2017 Nov 02,STING Senses Microbial Viability to Orchestrate Stress-Mediated Autophagy of the Endoplasmic Reticulum.,Moretti J; Roy S; Bozec D; Martinez J; Chapman JR; Ueberheide B; Lamming DW; Chen ZJ; Horng T; Yeretssian G; Green DR; Blander JM,False
726264064,27040497,2016 Apr 07,Oncogenic Role of Fusion-circRNAs Derived from Cancer-Associated Chromosomal Translocations.,Guarnerio J; Bezzi M; Jeong JC; Paffenholz SV; Berry K; Naldini MM; Lo-Coco F; Tay Y; Beck AH; Pandolfi PP,False
726270829,27058663,2016 Apr 07,Core circadian clock genes regulate leukemia stem cells in AML.,Puram RV; Kowalczyk MS; de Boer CG; Schneider RK; Miller PG; McConkey M; Tothova Z; Tejero H; Heckl D; Järås M; Chen MC; Li H; Tamayo A; Cowley GS; Rozenblatt-Rosen O; Al-Shahrour F; Regev A; Ebert BL,False
731530408,28965761,2017 Oct,Genomic patterns of de novo mutation in simplex autism,Turner TN; Coe BP; Dickel DE; Hoekzema K; Nelson BJ; Zody MC; Kronenberg ZN; Hormozdiari F; Raja A; Pennacchio LA; Darnell RB; Eichler EE,False
727719219,28622505,2017 Jun 15,An expanded view of complex traits: from polygenic to omnigenic.,Boyle EA; Li YI; Pritchard JK,False
732010908,29053968,2017 Oct 19,Multiscale 3D Genome Rewiring during Mouse Neural Development.,Bonev B; Mendelson Cohen N; Szabo Q; Fritsch L; Papadopoulos GL; Lubling Y; Xu X; Lv X; Hugnot JP; Tanay A; Cavalli G,False
728639728,28803726,2017 Aug 24,Golgi-Resident Gαo Promotes Protrusive Membrane Dynamics.,Solis GP; Bilousov O; Koval A; Lüchtenborg AM; Lin C; Katanaev VL,False
727343121,28235198,2017 02 23,Structure of the adenosine A1 receptor reveals the basis for subtype selectivity.,Glukhova A; Thal DM; Nguyen AT; Vecchio EA; Jörg M; Scammells PJ; May LT; Sexton PM; Christopoulos A,False
732010450,29056346,2017 Nov 16,Universal patterns of selection in cancer and somatic tissues.,Martincorena I; Raine KM; Gerstung M; Dawson KJ; Haase K; Van Loo P; Davies H; Stratton MR; Campbell PJ,False
732005439,29053971,2017 Oct 19,A Gut Microbial Mimic that Hijacks Diabetogenic Autoreactivity to Suppress Colitis.,Hebbandi Nanjundappa R; Ronchi F; Wang J; Clemente-Casares X; Yamanouchi J; Sokke Umeshappa C; Yang Y; Blanco J; Bassolas-Molina H; Salas A; Khan H; Slattery RM; Wyss M; Mooser C; Macpherson AJ; Sycuro LK; Serra P; McKay DM; McCoy KD; Santamaria P,False
731793770,28985565,2017 Oct 05,Genetic mapping and biochemical basis of yellow feather pigmentation in budgerigars.,Cooke TF; Fischer CR; Wu P; Jiang TX; Xie KT; Kuo J; Doctorov E; Zehnder A; Khosla C; Chuong CM; Bustamante CD,False
