id,pubMedId,publishedDateForPrint,title,authors,openAccess
718043568,23870121,2013 Jul 18,"SET1 and p300 act synergistically, through coupled histone modifications, in transcriptional activation by p53.",Tang Z; Chen WY; Shimada M; Nguyen UT; Kim J; Sun XJ; Sengoku T; McGinty RK; Fernandez JP; Muir TW; Roeder RG,False
717990720,23452857,2013 Feb 28,Encoding and transducing the synaptic or extrasynaptic origin of NMDA receptor signals to the nucleus.,Karpova A; Mikhaylova M; Bera S; Bär J; Reddy PP; Behnisch T; Rankovic V; Spilker C; Bethge P; Sahin J; Kaushik R; Zuschratter W; Kähne T; Naumann M; Gundelfinger ED; Kreutz MR,False
718003610,23582331,2013 Apr 11,Protein complexes are under evolutionary selection to assemble via ordered pathways.,Marsh JA; Hernández H; Hall Z; Ahnert SE; Perica T; Robinson CV; Teichmann SA,False
718061750,18243105,2008 Jan 25,High-resolution mapping and characterization of open chromatin across the genome.,Boyle AP; Davis S; Shulha HP; Meltzer P; Margulies EH; Weng Z; Furey TS; Crawford GE,False
30699,16904174,2006 Aug 25,Induction of pluripotent stem cells from mouse embryonic and adult fibroblast cultures by defined factors.,Takahashi K; Yamanaka S,False
13484063,21816272,2011 Aug 05,Directed conversion of Alzheimer's disease patient skin fibroblasts into functional neurons.,Qiang L; Fujita R; Yamashita T; Angulo S; Rhinn H; Rhee D; Doege C; Chau L; Aubry L; Vanti WB; Moreno H; Abeliovich A,False
718061728,15006355,2004 Mar 5,The mechanism of myosin VI translocation and its load-induced anchoring.,Altman D; Sweeney HL; Spudich JA,False
717967916,23178117,2012 Nov 21,MED12 controls the response to multiple cancer drugs through regulation of TGF-β receptor signaling.,Huang S; Hölzel M; Knijnenburg T; Schlicker A; Roepman P; McDermott U; Garnett M; Grernrum W; Sun C; Prahallad A; Groenendijk FH; Mittempergher L; Nijkamp W; Neefjes J; Salazar R; Ten Dijke P; Uramoto H; Tanaka F; Beijersbergen RL; Wessels LF; Bernards R,False
717959215,22980981,2012 Sep 14,Single-cell expression analyses during cellular reprogramming reveal an early stochastic and a late hierarchic phase.,Buganim Y; Faddah DA; Cheng AW; Itskovich E; Markoulaki S; Ganz K; Klemm SL; van Oudenaarden A; Jaenisch R,False
718042747,23827681,2013 Jul 03,OTU deubiquitinases reveal mechanisms of linkage specificity and enable ubiquitin chain restriction analysis.,Mevissen TE; Hospenthal MK; Geurink PP; Elliott PR; Akutsu M; Arnaudo N; Ekkebus R; Kulathu Y; Wauer T; El Oualid F; Freund SM; Ovaa H; Komander D,False
718052033,23332757,2013 Jan 17,SOD1 integrates signals from oxygen and glucose to repress respiration.,Reddi AR; Culotta VC,False
717959010,22901804,2012 Aug 17,Transcriptome-wide regulation of pre-mRNA splicing and mRNA localization by muscleblind proteins.,Wang ET; Cody NA; Jog S; Biancolella M; Wang TT; Treacy DJ; Luo S; Schroth GP; Housman DE; Reddy S; Lécuyer E; Burge CB,False
718003652,23540700,2013 Mar 28,Metformin retards aging in C. elegans by altering microbial folate and methionine metabolism.,Cabreiro F; Au C; Leung KY; Vergara-Irigaray N; Cochemé HM; Noori T; Weinkove D; Schuster E; Greene ND; Gems D,False
717986092,23452858,2013 Feb 28,A network of cytosolic factors targets SRP-independent proteins to the endoplasmic reticulum.,Ast T; Cohen G; Schuldiner M,False
718002950,23602153,2013 Apr 25,Genome-wide profiling of 5-formylcytosine reveals its roles in epigenetic priming.,Song CX; Szulwach KE; Dai Q; Fu Y; Mao SQ; Lin L; Street C; Li Y; Poidevin M; Wu H; Gao J; Liu P; Li L; Xu GL; Jin P; He C,False
718031854,23827678,2013 Jul 03,Second cistron in CACNA1A gene encodes a transcription factor mediating cerebellar development and SCA6.,Du X; Wang J; Zhu H; Rinaldo L; Lamar KM; Palmenberg AC; Hansel C; Gomez CM,False
718030604,23063130,2012 Oct 12,SMN is required for sensory-motor circuit function in Drosophila.,Imlach WL; Beck ES; Choi BJ; Lotti F; Pellizzoni L; McCabe BD,False
718007692,23643243,2013 May 09,One-step generation of mice carrying mutations in multiple genes by CRISPR/Cas-mediated genome engineering.,Wang H; Yang H; Shivalila CS; Dawlaty MM; Cheng AW; Zhang F; Jaenisch R,False
718021163,23768684,2013 Jun 20,A bilirubin-inducible fluorescent protein from eel muscle.,Kumagai A; Ando R; Miyatake H; Greimel P; Kobayashi T; Hirabayashi Y; Shimogori T; Miyawaki A,False
1092245,17803904,2007 Sep 07,A common mechanism of cellular death induced by bactericidal antibiotics.,Kohanski MA; Dwyer DJ; Hayete B; Lawrence CA; Collins JJ,False
717995850,23540698,2013 Mar 28,The Arabidopsis nucleosome remodeler DDM1 allows DNA methyltransferases to access H1-containing heterochromatin.,Zemach A; Kim MY; Hsieh PH; Coleman-Derr D; Eshed-Williams L; Thao K; Harmer SL; Zilberman D,False
717976888,23374344,2013 Jan 31,Vesicular glycolysis provides on-board energy for fast axonal transport.,Zala D; Hinckelmann MV; Yu H; Lyra da Cunha MM; Liot G; Cordelières FP; Marco S; Saudou F,False
718024889,23727112,2013 Jun 06,53BP1 mediates productive and mutagenic DNA repair through distinct phosphoprotein interactions.,Callen E; Di Virgilio M; Kruhlak MJ; Nieto-Soler M; Wong N; Chen HT; Faryabi RB; Polato F; Santos M; Starnes LM; Wesemann DR; Lee JE; Tubbs A; Sleckman BP; Daniel JA; Ge K; Alt FW; Fernandez-Capetillo O; Nussenzweig MC; Nussenzweig A,False
718024890,23374343,2013 Jan 31,Induction of Siglec-G by RNA viruses inhibits the innate immune response by promoting RIG-I degradation.,Chen W; Han C; Xie B; Hu X; Yu Q; Shi L; Wang Q; Li D; Wang J; Zheng P; Liu Y; Cao X,False
718026436,23791167,2013 Jun 20,"Integron attI1 sites, not riboswitches, associate with antibiotic resistance genes.",Roth A; Breaker RR,False
718023260,23706737,2013 May 23,Global regulation of promoter melting in naive lymphocytes.,Kouzine F; Wojtowicz D; Yamane A; Resch W; Kieffer-Kwon KR; Bandle R; Nelson S; Nakahashi H; Awasthi P; Feigenbaum L; Menoni H; Hoeijmakers J; Vermeulen W; Ge H; Przytycka TM; Levens D; Casellas R,False
718004166,23622247,2013 Apr 25,14-3-3 proteins interact with a hybrid prenyl-phosphorylation motif to inhibit G proteins.,Riou P; Kjær S; Garg R; Purkiss A; George R; Cain RJ; Bineva G; Reymond N; McColl B; Thompson AJ; O'Reilly N; McDonald NQ; Parker PJ; Ridley AJ,False
717968591,23201141,2012 Dec 07,General protein diffusion barriers create compartments within bacterial cells.,Schlimpert S; Klein EA; Briegel A; Hughes V; Kahnt J; Bolte K; Maier UG; Brun YV; Jensen GJ; Gitai Z; Thanbichler M,False
718009706,23663779,2013 May 09,Bacterial-derived uracil as a modulator of mucosal immunity and gut-microbe homeostasis in Drosophila.,Lee KA; Kim SH; Kim EK; Ha EM; You H; Kim B; Kim MJ; Kwon Y; Ryu JH; Lee WJ,False
718020258,23746843,2013 Jun 06,OTULIN antagonizes LUBAC signaling by specifically hydrolyzing Met1-linked polyubiquitin.,Keusekotten K; Elliott PR; Glockner L; Fiil BK; Damgaard RB; Kulathu Y; Wauer T; Hospenthal MK; Gyrd-Hansen M; Krappmann D; Hofmann K; Komander D,False
718021962,23746842,2013 Jun 06,Scaling of dorsal-ventral patterning by embryo size-dependent degradation of Spemann's organizer signals.,Inomata H; Shibata T; Haraguchi T; Sasai Y,False
718021244,23622248,2013 Apr 25,Mapping the human miRNA interactome by CLASH reveals frequent noncanonical binding.,Helwak A; Kudla G; Dudnakova T; Tollervey D,False
718013389,23664763,2013 May 23,Transcriptional and epigenetic dynamics during specification of human embryonic stem cells.,Gifford CA; Ziller MJ; Gu H; Trapnell C; Donaghey J; Tsankov A; Shalek AK; Kelley DR; Shishkin AA; Issner R; Zhang X; Coyne M; Fostel JL; Holmes L; Meldrim J; Guttman M; Epstein C; Park H; Kohlbacher O; Rinn J; Gnirke A; Lander ES; Bernstein BE; Meissner A,False
717956786,22939624,2012 Aug 31,Quantitative analysis of HSP90-client interactions reveals principles of substrate recognition.,Taipale M; Krykbaeva I; Koeva M; Kayatekin C; Westover KD; Karras GI; Lindquist S,False
718020290,8004678,1994 Jun 17,A lineage-specific transcriptional silencer regulates CD4 gene expression during T lymphocyte development.,Sawada S; Scarborough JD; Killeen N; Littman DR,False
718020304,22304925,2012 Feb 3,Optimality in the development of intestinal crypts.,Itzkovitz S; Blat IC; Jacks T; Clevers H; van Oudenaarden A,False
717952209,22464327,2012 Mar 30,The pan-ErbB negative regulator Lrig1 is an intestinal stem cell marker that functions as a tumor suppressor.,Powell AE; Wang Y; Li Y; Poulin EJ; Means AL; Washington MK; Higginbotham JN; Juchheim A; Prasad N; Levy SE; Guo Y; Shyr Y; Aronow BJ; Haigis KM; Franklin JL; Coffey RJ,False
717967829,23141545,2012 Nov 09,The loop position of shRNAs and pre-miRNAs is critical for the accuracy of dicer processing in vivo.,Gu S; Jin L; Zhang Y; Huang Y; Zhang F; Valdmanis PN; Kay MA,False
718002366,23541512,2013 Apr 11,A mechanism for localized lignin deposition in the endodermis.,Lee Y; Rubio MC; Alassimone J; Geldner N,False
718012395,14567919,2003 Oct 17,"A ""dock, lock, and latch"" structural model for a staphylococcal adhesin binding to fibrinogen.",Ponnuraj K; Bowden MG; Davis S; Gurusiddappa S; Moore D; Choe D; Xu Y; Hook M; Narayana SV,False
718000262,23582643,2013 Apr 25,TNF dually mediates resistance and susceptibility to mycobacteria via mitochondrial reactive oxygen species.,Roca FJ; Ramakrishnan L,False
718003520,23540701,2013 Mar 28,Diet-induced developmental acceleration independent of TOR and insulin in C. elegans.,MacNeil LT; Watson E; Arda HE; Zhu LJ; Walhout AJ,False
717597916,22726443,2012 Jun 22,Gut immune maturation depends on colonization with a host-specific microbiota.,Chung H; Pamp SJ; Hill JA; Surana NK; Edelman SM; Troy EB; Reading NC; Villablanca EJ; Wang S; Mora JR; Umesaki Y; Mathis D; Benoist C; Relman DA; Kasper DL,False
718016240,23706736,2013 May 23,Paused Pol II coordinates tissue morphogenesis in the Drosophila embryo.,Lagha M; Bothma JP; Esposito E; Ng S; Stefanik L; Tsui C; Johnston J; Chen K; Gilmour DS; Zeitlinger J; Levine MS,False
717999309,23453757,2013 Mar 28,Cand1 promotes assembly of new SCF complexes through dynamic exchange of F box proteins.,Pierce NW; Lee JE; Liu X; Sweredoski MJ; Graham RL; Larimore EA; Rome M; Zheng N; Clurman BE; Hess S; Shan SO; Deshaies RJ,False
717961828,22385965,2012 Mar 02,Slug and Sox9 cooperatively determine the mammary stem cell state.,Guo W; Keckesova Z; Donaher JL; Shibue T; Tischler V; Reinhardt F; Itzkovitz S; Noske A; Zürrer-Härdi U; Bell G; Tam WL; Mani SA; van Oudenaarden A; Weinberg RA,False
718013876,23706744,2013 May 23,A nutrient-responsive pathway that determines M phase timing through control of B-cyclin mRNA stability.,Messier V; Zenklusen D; Michnick SW,False
718015762,23622245,2013 Apr 25,Proteasome regulation by ADP-ribosylation.,Cho-Park PF; Steller H,False
718013214,23663780,2013 May 09,Homeostasis in intestinal epithelium is orchestrated by the circadian clock and microbiota cues transduced by TLRs.,Mukherji A; Kobiita A; Ye T; Chambon P,False
717991777,23523135,2013 Mar 28,Single-cell dynamics of genome-nuclear lamina interactions.,Kind J; Pagie L; Ortabozkoyun H; Boyle S; de Vries SS; Janssen H; Amendola M; Nolen LD; Bickmore WA; van Steensel B,False
718007506,23622246,2013 Apr 25,Nucleotide binding and conformational switching in the hexameric ring of a AAA+ machine.,Stinson BM; Nager AR; Glynn SE; Schmitz KR; Baker TA; Sauer RT,False
718011134,23683578,2013 Jun 06,Human embryonic stem cells derived by somatic cell nuclear transfer.,Tachibana M; Amato P; Sparman M; Gutierrez NM; Tippner-Hedges R; Ma H; Kang E; Fulati A; Lee HS; Sritanaudomchai H; Masterson K; Larson J; Eaton D; Sadler-Fredd K; Battaglia D; Lee D; Wu D; Jensen J; Patton P; Gokhale S; Stouffer RL; Wolf D; Mitalipov S,False
718006007,23540691,2013 Mar 28,Reversible disruption of mSWI/SNF (BAF) complexes by the SS18-SSX oncogenic fusion in synovial sarcoma.,Kadoch C; Crabtree GR,False
717972368,23332753,2013 Jan 17,Molecular adaptations allow dynein to generate large collective forces inside cells.,Rai AK; Rai A; Ramaiya AJ; Jha R; Mallik R,False
718003810,23623305,2013 May 09,Four-dimensional imaging of E. coli nucleoid organization and dynamics in living cells.,Fisher JK; Bourniquel A; Witz G; Weiner B; Prentiss M; Kleckner N,False
718001988,23602152,2013 Apr 25,Genome-wide analysis reveals TET- and TDG-dependent 5-methylcytosine oxidation dynamics.,Shen L; Wu H; Diep D; Yamaguchi S; D'Alessio AC; Fung HL; Zhang K; Zhang Y,False
717950207,22770213,2012 Jul 06,Extrathymic generation of regulatory T cells in placental mammals mitigates maternal-fetal conflict.,Samstein RM; Josefowicz SZ; Arvey A; Treuting PM; Rudensky AY,False
717980323,23415226,2013 Feb 14,Branching microtubule nucleation in Xenopus egg extracts mediated by augmin and TPX2.,Petry S; Groen AC; Ishihara K; Mitchison TJ; Vale RD,False
717995198,23540696,2013 Mar 28,Heritable remodeling of yeast multicellularity by an environmentally responsive prion.,Holmes DL; Lancaster AK; Lindquist S; Halfmann R,False
718008477,23622243,2013 Apr 25,The histone mark H3K36me3 regulates human DNA mismatch repair through its interaction with MutSα.,Li F; Mao G; Tong D; Huang J; Gu L; Yang W; Li GM,False
718003604,23245942,2012 Dec 21,Role of TAZ as mediator of Wnt signaling.,Azzolin L; Zanconato F; Bresolin S; Forcato M; Basso G; Bicciato S; Cordenonsi M; Piccolo S,False
717968525,23245941,2012 Dec 21,β-Catenin-driven cancers require a YAP1 transcriptional complex for survival and tumorigenesis.,Rosenbluh J; Nijhawan D; Cox AG; Li X; Neal JT; Schafer EJ; Zack TI; Wang X; Tsherniak A; Schinzel AC; Shao DD; Schumacher SE; Weir BA; Vazquez F; Cowley GS; Root DE; Mesirov JP; Beroukhim R; Kuo CJ; Goessling W; Hahn WC,False
718000271,23582328,2013 Apr 11,A Direct in vivo RNAi screen identifies MKK4 as a key regulator of liver regeneration.,Wuestefeld T; Pesic M; Rudalska R; Dauch D; Longerich T; Kang TW; Yevsa T; Heinzmann F; Hoenicke L; Hohmeyer A; Potapova A; Rittelmeier I; Jarek M; Geffers R; Scharfe M; Klawonn F; Schirmacher P; Malek NP; Ott M; Nordheim A; Vogel A; Manns MP; Zender L,False
1098247,18045539,2007 Nov 30,Integrating patterning signals: Wnt/GSK3 regulates the duration of the BMP/Smad1 signal.,Fuentealba LC; Eivers E; Ikeda A; Hurtado C; Kuroda H; Pera EM; De Robertis EM,False
718009470,6297757,1982 Nov,Many tumors induced by the mouse mammary tumor virus contain a provirus integrated in the same region of the host genome.,Nusse R; Varmus HE,False
718007450,23582320,2013 Apr 11,Higher-order assemblies in a new paradigm of signal transduction.,Wu H,False
718007494,21802129,2011 Aug 5,Tradeoffs and optimality in the evolution of gene regulation.,Poelwijk FJ; de Vos MG; Tans SJ,False
717980454,23415228,2013 Feb 14,A genetic program promotes C. elegans longevity at cold temperatures via a thermosensitive TRP channel.,Xiao R; Zhang B; Dong Y; Gong J; Xu T; Liu J; Xu XZ,False
718002368,23332765,2013 Jan 17,Monitoring tumorigenesis and senescence in vivo with a p16(INK4a)-luciferase model.,Burd CE; Sorrentino JA; Clark KS; Darr DB; Krishnamurthy J; Deal AM; Bardeesy N; Castrillon DH; Beach DH; Sharpless NE,False
718003003,23415232,2013 Feb 14,Regulation of transcription through acetylation of H3K122 on the lateral surface of the histone octamer.,Tropberger P; Pott S; Keller C; Kamieniarz-Gdula K; Caron M; Richter F; Li G; Mittler G; Liu ET; Bühler M; Margueron R; Schneider R,False
718006013,23452854,2013 Feb 28,Targeting placental growth factor/neuropilin 1 pathway inhibits growth and spread of medulloblastoma.,Snuderl M; Batista A; Kirkpatrick ND; Ruiz de Almodovar C; Riedemann L; Walsh EC; Anolik R; Huang Y; Martin JD; Kamoun W; Knevels E; Schmidt T; Farrar CT; Vakoc BJ; Mohan N; Chung E; Roberge S; Peterson T; Bais C; Zhelyazkova BH; Yip S; Hasselblatt M; Rossig C; Niemeyer E; Ferrara N; Klagsbrun M; Duda DG; Fukumura D; Xu L; Carmeliet P; Jain RK,False
718002700,22500800,2012 Apr 13,Delineation of joint molecule resolution pathways in meiosis identifies a crossover-specific resolvase.,Zakharyevich K; Tang S; Ma Y; Hunter N,False
717961693,23101624,2012 Oct 26,Selective protein synthesis by ribosomes with a drug-obstructed exit tunnel.,Kannan K; Vázquez-Laslop N; Mankin AS,False
717970133,23260144,2012 Dec 21,Multiple autism-linked genes mediate synapse elimination via proteasomal degradation of a synaptic scaffold PSD-95.,Tsai NP; Wilkerson JR; Guo W; Maksimova MA; DeMartino GN; Cowan CW; Huber KM,False
717986095,23452850,2013 Feb 28,Interaction domains of Sos1/Grb2 are finely tuned for cooperative control of embryonic stem cell fate.,Findlay GM; Smith MJ; Lanner F; Hsiung MS; Gish GD; Petsalaki E; Cockburn K; Kaneko T; Huang H; Bagshaw RD; Ketela T; Tucholska M; Taylor L; Bowtell DD; Moffat J; Ikura M; Li SS; Sidhu SS; Rossant J; Pawson T,False
718000122,23582322,2013 Apr 11,Master transcription factors and mediator establish super-enhancers at key cell identity genes.,Whyte WA; Orlando DA; Hnisz D; Abraham BJ; Lin CY; Kagey MH; Rahl PB; Lee TI; Young RA,False
717097851,22682250,2012 Jun 08,Complement C1q activates canonical Wnt signaling and promotes aging-related phenotypes.,Naito AT; Sumida T; Nomura S; Liu ML; Higo T; Nakagawa A; Okada K; Sakai T; Hashimoto A; Hara Y; Shimizu I; Zhu W; Toko H; Katada A; Akazawa H; Oka T; Lee JK; Minamino T; Nagai T; Walsh K; Kikuchi A; Matsumoto M; Botto M; Shiojima I; Komuro I,False
717999297,23219485,2012 Dec 21,Architecture of the Atg17 complex as a scaffold for autophagosome biogenesis.,Ragusa MJ; Stanley RE; Hurley JH,False
717997787,23434322,2013 Feb 28,Dynamic readers for 5-(hydroxy)methylcytosine and its oxidized derivatives.,Spruijt CG; Gnerlich F; Smits AH; Pfaffeneder T; Jansen PW; Bauer C; Münzel M; Wagner M; Müller M; Khan F; Eberl HC; Mensinga A; Brinkman AB; Lephikov K; Müller U; Walter J; Boelens R; van Ingen H; Leonhardt H; Carell T; Vermeulen M,False
717995199,23332748,2013 Jan 17,Developmentally regulated subnuclear genome reorganization restricts neural progenitor competence in Drosophila.,Kohwi M; Lupton JR; Lai SL; Miller MR; Doe CQ,False
717998382,23452859,2013 Feb 28,Profiling of ubiquitin-like modifications reveals features of mitotic control.,Merbl Y; Refour P; Patel H; Springer M; Kirschner MW,False
717979766,23415229,2013 Feb 14,Bacterial nitric oxide extends the lifespan of C. elegans.,Gusarov I; Gautier L; Smolentseva O; Shamovsky I; Eremina S; Mironov A; Nudler E,False
1012403,12553913,2003 Jan 24,The BDNF val66met polymorphism affects activity-dependent secretion of BDNF and human memory and hippocampal function.,Egan MF; Kojima M; Callicott JH; Goldberg TE; Kolachana BS; Bertolino A; Zaitsev E; Gold B; Goldman D; Dean M; Lu B; Weinberger DR,False
717986096,23452849,2013 Feb 28,Excess membrane synthesis drives a primitive mode of cell proliferation.,Mercier R; Kawai Y; Errington J,False
717982011,23415225,2013 Feb 14,Structural basis for recruitment and activation of the AP-1 clathrin adaptor complex by Arf1.,Ren X; Farías GG; Canagarajah BJ; Bonifacino JS; Hurley JH,False
717995853,23540692,2013 Mar 28,Hijacking the neuronal NMDAR signaling circuit to promote tumor growth and invasion.,Li L; Hanahan D,False
716598017,22632967,2012 May 25,Cyclin F-mediated degradation of ribonucleotide reductase M2 controls genome integrity and DNA repair.,D'Angiolella V; Donato V; Forrester FM; Jeong YT; Pellacani C; Kudo Y; Saraf A; Florens L; Washburn MP; Pagano M,False
14256970,22401813,2012 Mar 30,Systemic elevation of PTEN induces a tumor-suppressive metabolic state.,Garcia-Cao I; Song MS; Hobbs RM; Laurent G; Giorgi C; de Boer VC; Anastasiou D; Ito K; Sasaki AT; Rameh L; Carracedo A; Vander Heiden MG; Cantley LC; Pinton P; Haigis MC; Pandolfi PP,False
717968497,23217711,2012 Dec 07,An interdomain energetic tug-of-war creates the allosterically active state in Hsp70 molecular chaperones.,Zhuravleva A; Clerico EM; Gierasch LM,False
717991563,23415230,2013 Feb 14,"SMARCA3, a chromatin-remodeling factor, is required for p11-dependent antidepressant action.",Oh YS; Gao P; Lee KW; Ceglia I; Seo JS; Zhang X; Ahn JH; Chait BT; Patel DJ; Kim Y; Greengard P,False
717988214,23374347,2013 Jan 31,Bax crystal structures reveal how BH3 domains activate Bax and nucleate its oligomerization to induce apoptosis.,Czabotar PE; Westphal D; Dewson G; Ma S; Hockings C; Fairlie WD; Lee EF; Yao S; Robin AY; Smith BJ; Huang DC; Kluck RM; Adams JM; Colman PM,False
717991027,23374348,2013 Jan 31,The dynamic process of β(2)-adrenergic receptor activation.,Nygaard R; Zou Y; Dror RO; Mildorf TJ; Arlow DH; Manglik A; Pan AC; Liu CW; Fung JJ; Bokoch MP; Thian FS; Kobilka TS; Shaw DE; Mueller L; Prosser RS; Kobilka BK,False
717987079,23452853,2013 Feb 28,Regulation of WASH-dependent actin polymerization and protein trafficking by ubiquitination.,Hao YH; Doyle JM; Ramanathan S; Gomez TS; Jia D; Xu M; Chen ZJ; Billadeau DD; Rosen MK; Potts PR,False
717988236,23394946,2013 Feb 14,mTOR regulates lysosomal ATP-sensitive two-pore Na(+) channels to adapt to metabolic state.,Cang C; Zhou Y; Navarro B; Seo YJ; Aranda K; Shi L; Battaglia-Hsu S; Nissim I; Clapham DE; Ren D,False
717963229,23122649,2012 Nov 09,Protein group modification and synergy in the SUMO pathway as exemplified in DNA repair.,Psakhye I; Jentsch S,False
717973332,23352430,2013 Jan 31,Identification of early replicating fragile sites that contribute to genome instability.,Barlow JH; Faryabi RB; Callén E; Wong N; Malhowski A; Chen HT; Gutierrez-Cruz G; Sun HW; McKinnon P; Wright G; Casellas R; Robbiani DF; Staudt L; Fernandez-Capetillo O; Nussenzweig A,False
717989821,23434321,2013 Feb 28,CXCR4/CXCL12 mediate autocrine cell- cycle progression in NF1-associated malignant peripheral nerve sheath tumors.,Mo W; Chen J; Patel A; Zhang L; Chau V; Li Y; Cho W; Lim K; Xu J; Lazar AJ; Creighton CJ; Bolshakov S; McKay RM; Lev D; Le LQ; Parada LF,False
717991036,3935315,1985 Nov,RNP particles at splice junction sequences on Drosophila chorion transcripts.,Osheim YN; Miller OL; Beyer AL,False
8242,16096058,2005 Aug 12,Escaping the nuclear confines: signal-dependent pre-mRNA splicing in anucleate platelets.,Denis MM; Tolley ND; Bunting M; Schwertz H; Jiang H; Lindemann S; Yost CC; Rubner FJ; Albertine KH; Swoboda KJ; Fratto CM; Tolley E; Kraiss LW; McIntyre TM; Zimmerman GA; Weyrich AS,False
717991054,22817891,2012 Jul 20,Transcript dynamics of proinflammatory genes revealed by sequence analysis of subcellular RNA fractions.,Bhatt DM; Pandya-Jones A; Tong AJ; Barozzi I; Lissner MM; Natoli G; Black DL; Smale ST,False
717991055,21215366,2011 Jan 7,Epigenetics in alternative pre-mRNA splicing.,Luco RF; Allo M; Schor IE; Kornblihtt AR; Misteli T,False
13408018,22118462,2011 Nov 23,Single-molecule imaging of transcriptionally coupled and uncoupled splicing.,Vargas DY; Shah K; Batish M; Levandoski M; Sinha S; Marras SA; Schedl P; Tyagi S,False
717986094,23452855,2013 Feb 28,Competing E3 ubiquitin ligases govern circadian periodicity by degradation of CRY in nucleus and cytoplasm.,Yoo SH; Mohawk JA; Siepka SM; Shan Y; Huh SK; Hong HK; Kornblum I; Kumar V; Koike N; Xu M; Nussbaum J; Liu X; Chen Z; Chen ZJ; Green CB; Takahashi JS,False
717972362,23332764,2013 Jan 17,DNA-binding specificities of human transcription factors.,Jolma A; Yan J; Whitington T; Toivonen J; Nitta KR; Rastas P; Morgunova E; Enge M; Taipale M; Wei G; Palin K; Vaquerizas JM; Vincentelli R; Luscombe NM; Hughes TR; Lemaire P; Ukkonen E; Kivioja T; Taipale J,False
717988647,23260136,2012 Dec 21,Whole-genome sequencing in autism identifies hot spots for de novo germline mutation.,Michaelson JJ; Shi Y; Gujral M; Zheng H; Malhotra D; Jin X; Jian M; Liu G; Greer D; Bhandari A; Wu W; Corominas R; Peoples A; Koren A; Gore A; Kang S; Lin GN; Estabillo J; Gadomski T; Singh B; Zhang K; Akshoomoff N; Corsello C; McCarroll S; Iakoucheva LM; Li Y; Wang J; Sebat J,False
717988278,23332760,2013 Jan 17,Derepression of a neuronal inhibitor due to miRNA dysregulation in a schizophrenia-related microdeletion.,Xu B; Hsu PK; Stark KL; Karayiorgou M; Gogos JA,False
717963935,22901810,2012 Aug 17,Extracellular M. tuberculosis DNA targets bacteria for autophagy by activating the host DNA-sensing pathway.,Watson RO; Manzanillo PS; Cox JS,False
717968584,23217717,2012 Dec 07,Noninvasive imaging beyond the diffraction limit of 3D dynamics in thickly fluorescent specimens.,Gao L; Shao L; Higgins CD; Poulton JS; Peifer M; Davidson MW; Wu X; Goldstein B; Betzig E,False
717987108,23374353,2013 Jan 31,Melanocortin 4 receptors reciprocally regulate sympathetic and parasympathetic preganglionic neurons.,Sohn JW; Harris LE; Berglund ED; Liu T; Vong L; Lowell BB; Balthasar N; Williams KW; Elmquist JK,False
717963721,23102813,2012 Nov 09,LIN28A is a suppressor of ER-associated translation in embryonic stem cells.,Cho J; Chang H; Kwon SC; Kim B; Kim Y; Choe J; Ha M; Kim YK; Kim VN,False
717982879,23415221,2013 Feb 14,Identifying recent adaptations in large-scale genomic data.,Grossman SR; Andersen KG; Shlyakhter I; Tabrizi S; Winnicki S; Yen A; Park DJ; Griesemer D; Karlsson EK; Wong SH; Cabili M; Adegbola RA; Bamezai RN; Hill AV; Vannberg FO; Rinn JL; 1000 Genomes Project; Lander ES; Schaffner SF; Sabeti PC,False
717978715,23374349,2013 Jan 31,Conformational coupling across the plasma membrane in activation of the EGF receptor.,Endres NF; Das R; Smith AW; Arkhipov A; Kovacs E; Huang Y; Pelton JG; Shan Y; Shaw DE; Wemmer DE; Groves JT; Kuriyan J,False
717967639,23101625,2012 Oct 26,Activation of innate immunity is required for efficient nuclear reprogramming.,Lee J; Sayed N; Hunter A; Au KF; Wong WH; Mocarski ES; Pera RR; Yakubov E; Cooke JP,False
717956409,22980983,2012 Sep 14,A spatially-organized multicellular innate immune response in lymph nodes limits systemic pathogen spread.,Kastenmüller W; Torabi-Parizi P; Subramanian N; Lämmermann T; Germain RN,False
